{
    "datasetVersion": "v1",
    "generatedAt": "2026-01-08T18:00:00Z",
    "notes": "Ground-truth fixtures for Philosophy Detection Engine validation.",
    "portfolios": [
        {
            "id": "boglehead_vti_vxus_bnd",
            "description": "Classic 3-fund Boglehead, broad indexing with bond ballast.",
            "archetype": "pure Boglehead",
            "baseCurrency": "USD",
            "holdings": [
                {
                    "ticker": "VTI",
                    "value": 70000,
                    "currency": "USD",
                    "assetType": "etf"
                },
                {
                    "ticker": "VXUS",
                    "value": 20000,
                    "currency": "USD",
                    "assetType": "etf"
                },
                {
                    "ticker": "BND",
                    "value": 10000,
                    "currency": "USD",
                    "assetType": "etf"
                }
            ],
            "expected": {
                "primaryPhilosophy": "passive_indexing",
                "secondaryPhilosophies": [
                    "balanced_allocation"
                ],
                "requiredPrimaryInTopK": 1
            },
            "edgeCaseFlags": [
                "pure_archetype"
            ]
        },
        {
            "id": "boglehead_canada_xeqt_only",
            "description": "Single-ticket global equity ETF (Canada).",
            "archetype": "single ETF indexer",
            "baseCurrency": "CAD",
            "holdings": [
                {
                    "ticker": "XEQT.TO",
                    "value": 100000,
                    "currency": "CAD",
                    "assetType": "etf"
                }
            ],
            "expected": {
                "primaryPhilosophy": "passive_indexing",
                "secondaryPhilosophies": [
                    "equity_only"
                ],
                "requiredPrimaryInTopK": 1
            },
            "edgeCaseFlags": [
                "pure_archetype",
                "home_bias",
                "multi_currency"
            ]
        },
        {
            "id": "factor_tilt_avuv_avdv_core",
            "description": "Core index + strong SCV tilt US and ex-US.",
            "archetype": "factor investor (size/value)",
            "baseCurrency": "USD",
            "holdings": [
                {
                    "ticker": "VTI",
                    "value": 50000,
                    "currency": "USD",
                    "assetType": "etf"
                },
                {
                    "ticker": "VXUS",
                    "value": 15000,
                    "currency": "USD",
                    "assetType": "etf"
                },
                {
                    "ticker": "AVUV",
                    "value": 25000,
                    "currency": "USD",
                    "assetType": "etf"
                },
                {
                    "ticker": "AVDV",
                    "value": 10000,
                    "currency": "USD",
                    "assetType": "etf"
                }
            ],
            "expected": {
                "primaryPhilosophy": "factor_investing",
                "secondaryPhilosophies": [
                    "passive_indexing"
                ],
                "requiredPrimaryInTopK": 1
            },
            "edgeCaseFlags": [
                "pure_archetype"
            ]
        },
        {
            "id": "em_tilt_vwo_majority",
            "description": "Emerging markets dominates allocation.",
            "archetype": "EM tilt",
            "baseCurrency": "USD",
            "holdings": [
                {
                    "ticker": "VWO",
                    "value": 60000,
                    "currency": "USD",
                    "assetType": "etf"
                },
                {
                    "ticker": "VTI",
                    "value": 25000,
                    "currency": "USD",
                    "assetType": "etf"
                },
                {
                    "ticker": "VXUS",
                    "value": 15000,
                    "currency": "USD",
                    "assetType": "etf"
                }
            ],
            "expected": {
                "primaryPhilosophy": "emerging_markets_tilt",
                "secondaryPhilosophies": [
                    "passive_indexing"
                ]
            },
            "edgeCaseFlags": [
                "em_tilt"
            ]
        },
        {
            "id": "dividend_growth_schd_vig",
            "description": "Dividend growth / quality income tilt.",
            "archetype": "dividend growth",
            "baseCurrency": "USD",
            "holdings": [
                {
                    "ticker": "SCHD",
                    "value": 60000,
                    "currency": "USD",
                    "assetType": "etf"
                },
                {
                    "ticker": "VIG",
                    "value": 20000,
                    "currency": "USD",
                    "assetType": "etf"
                },
                {
                    "ticker": "BND",
                    "value": 20000,
                    "currency": "USD",
                    "assetType": "etf"
                }
            ],
            "expected": {
                "primaryPhilosophy": "dividend_growth",
                "secondaryPhilosophies": [
                    "income_focused",
                    "balanced_allocation"
                ]
            },
            "edgeCaseFlags": []
        },
        {
            "id": "income_options_overlay_jepi_qyld",
            "description": "Option-income ETFs as core (covered call / equity premium).",
            "archetype": "options income",
            "baseCurrency": "USD",
            "holdings": [
                {
                    "ticker": "JEPI",
                    "value": 50000,
                    "currency": "USD",
                    "assetType": "etf"
                },
                {
                    "ticker": "QYLD",
                    "value": 30000,
                    "currency": "USD",
                    "assetType": "etf"
                },
                {
                    "ticker": "BIL",
                    "value": 20000,
                    "currency": "USD",
                    "assetType": "cash_equivalent"
                }
            ],
            "expected": {
                "primaryPhilosophy": "options_overlay_income",
                "secondaryPhilosophies": [
                    "income_focused"
                ]
            },
            "edgeCaseFlags": [
                "options_overlay"
            ]
        },
        {
            "id": "all_weather_risk_parity_like",
            "description": "Diversified across stocks, long/intermediate treasuries, gold, commodities.",
            "archetype": "all-weather / risk parity",
            "baseCurrency": "USD",
            "holdings": [
                {
                    "ticker": "VTI",
                    "value": 30000,
                    "currency": "USD",
                    "assetType": "etf"
                },
                {
                    "ticker": "TLT",
                    "value": 30000,
                    "currency": "USD",
                    "assetType": "etf"
                },
                {
                    "ticker": "IEF",
                    "value": 15000,
                    "currency": "USD",
                    "assetType": "etf"
                },
                {
                    "ticker": "GLD",
                    "value": 15000,
                    "currency": "USD",
                    "assetType": "etf"
                },
                {
                    "ticker": "DBC",
                    "value": 10000,
                    "currency": "USD",
                    "assetType": "etf"
                }
            ],
            "expected": {
                "primaryPhilosophy": "all_weather_risk_parity",
                "secondaryPhilosophies": [
                    "diversification_maximalist"
                ]
            },
            "edgeCaseFlags": []
        },
        {
            "id": "barbell_conservative",
            "description": "Barbell: mostly T-bills/cash equivalents + small sleeve of growth.",
            "archetype": "barbell conservative",
            "baseCurrency": "USD",
            "holdings": [
                {
                    "ticker": "SGOV",
                    "value": 75000,
                    "currency": "USD",
                    "assetType": "cash_equivalent"
                },
                {
                    "ticker": "QQQ",
                    "value": 20000,
                    "currency": "USD",
                    "assetType": "etf"
                },
                {
                    "ticker": "BTC",
                    "value": 5000,
                    "currency": "USD",
                    "assetType": "crypto"
                }
            ],
            "expected": {
                "primaryPhilosophy": "barbell_strategy",
                "secondaryPhilosophies": [
                    "capital_preservation"
                ]
            },
            "edgeCaseFlags": [
                "mixed_signals"
            ]
        },
        {
            "id": "capital_preservation_tbill_heavy",
            "description": "Near-cash allocation dominates.",
            "archetype": "capital preservation",
            "baseCurrency": "USD",
            "holdings": [
                {
                    "ticker": "BIL",
                    "value": 90000,
                    "currency": "USD",
                    "assetType": "cash_equivalent"
                },
                {
                    "ticker": "AGG",
                    "value": 10000,